{
  "epistemic_state": "CLASSIFIED",
  "evidence_ids": [
    "EVID-WEB-004"
  ],
  "export_id": "SIGEXP-SF-008",
  "export_version": 1,
  "external_provider_state": "NOT_RUN",
  "freshness": {
    "observed_at": "2026-08-25T00:00:00+03:00",
    "supersedes_export_id": null,
    "valid_until": null
  },
  "generated_at": "2026-08-25T00:00:00+03:00",
  "pattern": {
    "a_roll_integration": "return_cut",
    "broll_function": "prove_state",
    "cta_exit": "answer_question",
    "hook_mechanism": "diagnostic_question",
    "pacing_profile": "held_reveal",
    "proof_form": "constraint",
    "risk_class": "source_dependent",
    "sound_role": "ambient_bed",
    "text_role": "no_text",
    "transition_family": "push",
    "viewer_job": "learn_mechanism",
    "visual_grammar": "layered_pip"
  },
  "provenance": {
    "raw_object_state": "NOT_AVAILABLE",
    "record_hash": "sha256:94573e360fca7cb7e968a8d24d38d7117fb42482c7ddc6f57fbacd5b91a9139d",
    "source_raw_hashes": []
  },
  "rights_decision_ids": [
    "RIGHTS-PUBLIC-COMMENTARY-001"
  ],
  "rights_state": "metadata_commentary_only",
  "schema": "signal-to-studio.v1",
  "signal_record_id": "SIG-SF-008",
  "source_ids": [
    "SRC-WEB-004"
  ],
  "studio_constraints": {
    "acceptance_checks": [
      "Opening hook signal occurs in the first 1000 ms.",
      "Every visual change has a story function and explicit A-roll state.",
      "No source expression, brand UI, identity, or restricted media is reused."
    ],
    "aspect_ratio": "9:16",
    "duration_ms": 5000,
    "editable_text": true,
    "safe_zone": "platform-ui-aware; 8% horizontal and 10% vertical local planning inset; verify per platform at production"
  },
  "taxonomy_version": "studio-shortform@1.0.0"
}
