{
  "epistemic_state": "CLASSIFIED",
  "evidence_ids": [
    "EVID-WEB-011"
  ],
  "export_id": "SIGEXP-SF-053",
  "export_version": 1,
  "external_provider_state": "NOT_RUN",
  "freshness": {
    "observed_at": "2026-08-25T00:00:00+03:00",
    "supersedes_export_id": null,
    "valid_until": null
  },
  "generated_at": "2026-08-25T00:00:00+03:00",
  "pattern": {
    "a_roll_integration": "return_cut",
    "broll_function": "demonstrate_process",
    "cta_exit": "recap",
    "hook_mechanism": "story_in_progress",
    "pacing_profile": "rapid_beat",
    "proof_form": "constraint",
    "risk_class": "source_dependent",
    "sound_role": "voice_anchor",
    "text_role": "keyword_captions",
    "transition_family": "wipe",
    "viewer_job": "identify_problem",
    "visual_grammar": "kinetic_type"
  },
  "provenance": {
    "raw_object_state": "NOT_AVAILABLE",
    "record_hash": "sha256:3ede4c91aca78195980e0dbeb5f01575a79f8dc1da991ac529e69111fa4ce8dc",
    "source_raw_hashes": []
  },
  "rights_decision_ids": [
    "RIGHTS-PUBLIC-COMMENTARY-001"
  ],
  "rights_state": "metadata_commentary_only",
  "schema": "signal-to-studio.v1",
  "signal_record_id": "SIG-SF-053",
  "source_ids": [
    "SRC-WEB-001"
  ],
  "studio_constraints": {
    "acceptance_checks": [
      "Opening hook signal occurs in the first 1000 ms.",
      "Every visual change has a story function and explicit A-roll state.",
      "No source expression, brand UI, identity, or restricted media is reused."
    ],
    "aspect_ratio": "9:16",
    "duration_ms": 8000,
    "editable_text": true,
    "safe_zone": "platform-ui-aware; 8% horizontal and 10% vertical local planning inset; verify per platform at production"
  },
  "taxonomy_version": "studio-shortform@1.0.0"
}
