{
  "epistemic_state": "CLASSIFIED",
  "evidence_ids": [
    "EVID-WEB-005"
  ],
  "export_id": "SIGEXP-SF-023",
  "export_version": 1,
  "external_provider_state": "NOT_RUN",
  "freshness": {
    "observed_at": "2026-08-25T00:00:00+03:00",
    "supersedes_export_id": null,
    "valid_until": null
  },
  "generated_at": "2026-08-25T00:00:00+03:00",
  "pattern": {
    "a_roll_integration": "delayed_reveal",
    "broll_function": "contrast",
    "cta_exit": "next_step",
    "hook_mechanism": "consequence",
    "pacing_profile": "slow_observation",
    "proof_form": "calculation",
    "risk_class": "low",
    "sound_role": "silence_drop",
    "text_role": "step_counter",
    "transition_family": "graphic_reveal",
    "viewer_job": "assess_risk",
    "visual_grammar": "diagram_build"
  },
  "provenance": {
    "raw_object_state": "NOT_AVAILABLE",
    "record_hash": "sha256:a79e4b9f23f2f1256b6b4d261b0ffbe02cde12323a72020b39adefc9c3778ec8",
    "source_raw_hashes": []
  },
  "rights_decision_ids": [
    "RIGHTS-PUBLIC-COMMENTARY-001"
  ],
  "rights_state": "metadata_commentary_only",
  "schema": "signal-to-studio.v1",
  "signal_record_id": "SIG-SF-023",
  "source_ids": [
    "SRC-WEB-004"
  ],
  "studio_constraints": {
    "acceptance_checks": [
      "Opening hook signal occurs in the first 1000 ms.",
      "Every visual change has a story function and explicit A-roll state.",
      "No source expression, brand UI, identity, or restricted media is reused."
    ],
    "aspect_ratio": "9:16",
    "duration_ms": 8000,
    "editable_text": true,
    "safe_zone": "platform-ui-aware; 8% horizontal and 10% vertical local planning inset; verify per platform at production"
  },
  "taxonomy_version": "studio-shortform@1.0.0"
}
