{
  "epistemic_state": "CLASSIFIED",
  "evidence_ids": [
    "EVID-WEB-007"
  ],
  "export_id": "SIGEXP-SF-035",
  "export_version": 1,
  "external_provider_state": "NOT_RUN",
  "freshness": {
    "observed_at": "2026-08-25T00:00:00+03:00",
    "supersedes_export_id": null,
    "valid_until": null
  },
  "generated_at": "2026-08-25T00:00:00+03:00",
  "pattern": {
    "a_roll_integration": "delayed_reveal",
    "broll_function": "demonstrate_process",
    "cta_exit": "comment_prompt",
    "hook_mechanism": "countdown",
    "pacing_profile": "measured_beat",
    "proof_form": "calculation",
    "risk_class": "source_dependent",
    "sound_role": "voice_anchor",
    "text_role": "question_card",
    "transition_family": "cut_on_sound",
    "viewer_job": "compare_options",
    "visual_grammar": "kinetic_type"
  },
  "provenance": {
    "raw_object_state": "NOT_AVAILABLE",
    "record_hash": "sha256:2e243a2264eb270e20ca43c85cb26538b92a7a02a29acc81312469003d4aaee4",
    "source_raw_hashes": []
  },
  "rights_decision_ids": [
    "RIGHTS-PUBLIC-COMMENTARY-001"
  ],
  "rights_state": "metadata_commentary_only",
  "schema": "signal-to-studio.v1",
  "signal_record_id": "SIG-SF-035",
  "source_ids": [
    "SRC-WEB-005"
  ],
  "studio_constraints": {
    "acceptance_checks": [
      "Opening hook signal occurs in the first 1000 ms.",
      "Every visual change has a story function and explicit A-roll state.",
      "No source expression, brand UI, identity, or restricted media is reused."
    ],
    "aspect_ratio": "9:16",
    "duration_ms": 8000,
    "editable_text": true,
    "safe_zone": "platform-ui-aware; 8% horizontal and 10% vertical local planning inset; verify per platform at production"
  },
  "taxonomy_version": "studio-shortform@1.0.0"
}
