{
  "epistemic_state": "CLASSIFIED",
  "evidence_ids": [
    "EVID-WEB-007"
  ],
  "export_id": "SIGEXP-SF-034",
  "export_version": 1,
  "external_provider_state": "NOT_RUN",
  "freshness": {
    "observed_at": "2026-08-25T00:00:00+03:00",
    "supersedes_export_id": null,
    "valid_until": null
  },
  "generated_at": "2026-08-25T00:00:00+03:00",
  "pattern": {
    "a_roll_integration": "full_open",
    "broll_function": "concretize_abstraction",
    "cta_exit": "no_cta",
    "hook_mechanism": "countdown",
    "pacing_profile": "rapid_beat",
    "proof_form": "observed_artifact",
    "risk_class": "source_dependent",
    "sound_role": "ambient_bed",
    "text_role": "headline_only",
    "transition_family": "dissolve",
    "viewer_job": "learn_mechanism",
    "visual_grammar": "layered_pip"
  },
  "provenance": {
    "raw_object_state": "NOT_AVAILABLE",
    "record_hash": "sha256:a027a40099971f69f776b3c08a5ebafcc11f0ed54f7c72b76351469cbeb838a5",
    "source_raw_hashes": []
  },
  "rights_decision_ids": [
    "RIGHTS-PUBLIC-COMMENTARY-001"
  ],
  "rights_state": "metadata_commentary_only",
  "schema": "signal-to-studio.v1",
  "signal_record_id": "SIG-SF-034",
  "source_ids": [
    "SRC-WEB-005"
  ],
  "studio_constraints": {
    "acceptance_checks": [
      "Opening hook signal occurs in the first 1000 ms.",
      "Every visual change has a story function and explicit A-roll state.",
      "No source expression, brand UI, identity, or restricted media is reused."
    ],
    "aspect_ratio": "9:16",
    "duration_ms": 7000,
    "editable_text": true,
    "safe_zone": "platform-ui-aware; 8% horizontal and 10% vertical local planning inset; verify per platform at production"
  },
  "taxonomy_version": "studio-shortform@1.0.0"
}
