{
  "epistemic_state": "CLASSIFIED",
  "evidence_ids": [
    "EVID-WEB-011"
  ],
  "export_id": "SIGEXP-SF-052",
  "export_version": 1,
  "external_provider_state": "NOT_RUN",
  "freshness": {
    "observed_at": "2026-08-25T00:00:00+03:00",
    "supersedes_export_id": null,
    "valid_until": null
  },
  "generated_at": "2026-08-25T00:00:00+03:00",
  "pattern": {
    "a_roll_integration": "picture_in_picture",
    "broll_function": "concretize_abstraction",
    "cta_exit": "save_reference",
    "hook_mechanism": "story_in_progress",
    "pacing_profile": "slow_observation",
    "proof_form": "process_trace",
    "risk_class": "source_dependent",
    "sound_role": "ambient_bed",
    "text_role": "question_card",
    "transition_family": "push",
    "viewer_job": "imagine_outcome",
    "visual_grammar": "layered_pip"
  },
  "provenance": {
    "raw_object_state": "NOT_AVAILABLE",
    "record_hash": "sha256:5680f51c848e0b0b55cd06b8201339fc5e6fa6579c89e3d700cc6b45a855bb65",
    "source_raw_hashes": []
  },
  "rights_decision_ids": [
    "RIGHTS-PUBLIC-COMMENTARY-001"
  ],
  "rights_state": "metadata_commentary_only",
  "schema": "signal-to-studio.v1",
  "signal_record_id": "SIG-SF-052",
  "source_ids": [
    "SRC-WEB-001"
  ],
  "studio_constraints": {
    "acceptance_checks": [
      "Opening hook signal occurs in the first 1000 ms.",
      "Every visual change has a story function and explicit A-roll state.",
      "No source expression, brand UI, identity, or restricted media is reused."
    ],
    "aspect_ratio": "9:16",
    "duration_ms": 7000,
    "editable_text": true,
    "safe_zone": "platform-ui-aware; 8% horizontal and 10% vertical local planning inset; verify per platform at production"
  },
  "taxonomy_version": "studio-shortform@1.0.0"
}
