{
  "epistemic_state": "CLASSIFIED",
  "evidence_ids": [
    "EVID-WEB-011"
  ],
  "export_id": "SIGEXP-SF-054",
  "export_version": 1,
  "external_provider_state": "NOT_RUN",
  "freshness": {
    "observed_at": "2026-08-25T00:00:00+03:00",
    "supersedes_export_id": null,
    "valid_until": null
  },
  "generated_at": "2026-08-25T00:00:00+03:00",
  "pattern": {
    "a_roll_integration": "absent",
    "broll_function": "prove_state",
    "cta_exit": "loop_to_open",
    "hook_mechanism": "story_in_progress",
    "pacing_profile": "measured_beat",
    "proof_form": "worked_example",
    "risk_class": "source_dependent",
    "sound_role": "voice_plus_accent",
    "text_role": "proof_callout",
    "transition_family": "dissolve",
    "viewer_job": "assess_risk",
    "visual_grammar": "split_screen"
  },
  "provenance": {
    "raw_object_state": "NOT_AVAILABLE",
    "record_hash": "sha256:847938797ff0b2f540e872e4add75bbd2b86184cd08f613ae7f1fbbd9ecf5359",
    "source_raw_hashes": []
  },
  "rights_decision_ids": [
    "RIGHTS-PUBLIC-COMMENTARY-001"
  ],
  "rights_state": "metadata_commentary_only",
  "schema": "signal-to-studio.v1",
  "signal_record_id": "SIG-SF-054",
  "source_ids": [
    "SRC-WEB-001"
  ],
  "studio_constraints": {
    "acceptance_checks": [
      "Opening hook signal occurs in the first 1000 ms.",
      "Every visual change has a story function and explicit A-roll state.",
      "No source expression, brand UI, identity, or restricted media is reused."
    ],
    "aspect_ratio": "9:16",
    "duration_ms": 9000,
    "editable_text": true,
    "safe_zone": "platform-ui-aware; 8% horizontal and 10% vertical local planning inset; verify per platform at production"
  },
  "taxonomy_version": "studio-shortform@1.0.0"
}
