{
  "epistemic_state": "CLASSIFIED",
  "evidence_ids": [
    "EVID-WEB-007"
  ],
  "export_id": "SIGEXP-SF-032",
  "export_version": 1,
  "external_provider_state": "NOT_RUN",
  "freshness": {
    "observed_at": "2026-08-25T00:00:00+03:00",
    "supersedes_export_id": null,
    "valid_until": null
  },
  "generated_at": "2026-08-25T00:00:00+03:00",
  "pattern": {
    "a_roll_integration": "return_cut",
    "broll_function": "attention_reset",
    "cta_exit": "recap",
    "hook_mechanism": "countdown",
    "pacing_profile": "held_reveal",
    "proof_form": "constraint",
    "risk_class": "source_dependent",
    "sound_role": "accent_sfx",
    "text_role": "step_counter",
    "transition_family": "push",
    "viewer_job": "identify_problem",
    "visual_grammar": "mock_screen_capture"
  },
  "provenance": {
    "raw_object_state": "NOT_AVAILABLE",
    "record_hash": "sha256:b98e88fbafe79de418abe4ac9a624590b6800ddca95ea39e980e7473b8bf5d5c",
    "source_raw_hashes": []
  },
  "rights_decision_ids": [
    "RIGHTS-PUBLIC-COMMENTARY-001"
  ],
  "rights_state": "metadata_commentary_only",
  "schema": "signal-to-studio.v1",
  "signal_record_id": "SIG-SF-032",
  "source_ids": [
    "SRC-WEB-005"
  ],
  "studio_constraints": {
    "acceptance_checks": [
      "Opening hook signal occurs in the first 1000 ms.",
      "Every visual change has a story function and explicit A-roll state.",
      "No source expression, brand UI, identity, or restricted media is reused."
    ],
    "aspect_ratio": "9:16",
    "duration_ms": 5000,
    "editable_text": true,
    "safe_zone": "platform-ui-aware; 8% horizontal and 10% vertical local planning inset; verify per platform at production"
  },
  "taxonomy_version": "studio-shortform@1.0.0"
}
