{
  "epistemic_state": "CLASSIFIED",
  "evidence_ids": [
    "EVID-WEB-006"
  ],
  "export_id": "SIGEXP-SF-030",
  "export_version": 1,
  "external_provider_state": "NOT_RUN",
  "freshness": {
    "observed_at": "2026-08-25T00:00:00+03:00",
    "supersedes_export_id": null,
    "valid_until": null
  },
  "generated_at": "2026-08-25T00:00:00+03:00",
  "pattern": {
    "a_roll_integration": "absent",
    "broll_function": "concretize_abstraction",
    "cta_exit": "next_step",
    "hook_mechanism": "before_after",
    "pacing_profile": "measured_beat",
    "proof_form": "worked_example",
    "risk_class": "low",
    "sound_role": "accent_sfx",
    "text_role": "labels",
    "transition_family": "dissolve",
    "viewer_job": "compare_options",
    "visual_grammar": "mock_screen_capture"
  },
  "provenance": {
    "raw_object_state": "NOT_AVAILABLE",
    "record_hash": "sha256:fb2ff380b0270d89844efca997c7b1b16d29317bf8839acbd2cd63d74699c14a",
    "source_raw_hashes": []
  },
  "rights_decision_ids": [
    "RIGHTS-PUBLIC-COMMENTARY-001"
  ],
  "rights_state": "metadata_commentary_only",
  "schema": "signal-to-studio.v1",
  "signal_record_id": "SIG-SF-030",
  "source_ids": [
    "SRC-WEB-004"
  ],
  "studio_constraints": {
    "acceptance_checks": [
      "Opening hook signal occurs in the first 1000 ms.",
      "Every visual change has a story function and explicit A-roll state.",
      "No source expression, brand UI, identity, or restricted media is reused."
    ],
    "aspect_ratio": "9:16",
    "duration_ms": 9000,
    "editable_text": true,
    "safe_zone": "platform-ui-aware; 8% horizontal and 10% vertical local planning inset; verify per platform at production"
  },
  "taxonomy_version": "studio-shortform@1.0.0"
}
