{
  "epistemic_state": "CLASSIFIED",
  "evidence_ids": [
    "EVID-WEB-011"
  ],
  "export_id": "SIGEXP-SF-050",
  "export_version": 1,
  "external_provider_state": "NOT_RUN",
  "freshness": {
    "observed_at": "2026-08-25T00:00:00+03:00",
    "supersedes_export_id": null,
    "valid_until": null
  },
  "generated_at": "2026-08-25T00:00:00+03:00",
  "pattern": {
    "a_roll_integration": "delayed_reveal",
    "broll_function": "attention_reset",
    "cta_exit": "answer_question",
    "hook_mechanism": "story_in_progress",
    "pacing_profile": "measured_beat",
    "proof_form": "calculation",
    "risk_class": "source_dependent",
    "sound_role": "accent_sfx",
    "text_role": "no_text",
    "transition_family": "match_on_action",
    "viewer_job": "compare_options",
    "visual_grammar": "mock_screen_capture"
  },
  "provenance": {
    "raw_object_state": "NOT_AVAILABLE",
    "record_hash": "sha256:fd778bbedeff88e294dab093ad71d76d80f062be687835bc188e96c5925dca41",
    "source_raw_hashes": []
  },
  "rights_decision_ids": [
    "RIGHTS-PUBLIC-COMMENTARY-001"
  ],
  "rights_state": "metadata_commentary_only",
  "schema": "signal-to-studio.v1",
  "signal_record_id": "SIG-SF-050",
  "source_ids": [
    "SRC-WEB-001"
  ],
  "studio_constraints": {
    "acceptance_checks": [
      "Opening hook signal occurs in the first 1000 ms.",
      "Every visual change has a story function and explicit A-roll state.",
      "No source expression, brand UI, identity, or restricted media is reused."
    ],
    "aspect_ratio": "9:16",
    "duration_ms": 5000,
    "editable_text": true,
    "safe_zone": "platform-ui-aware; 8% horizontal and 10% vertical local planning inset; verify per platform at production"
  },
  "taxonomy_version": "studio-shortform@1.0.0"
}
