{
  "epistemic_state": "CLASSIFIED",
  "evidence_ids": [
    "EVID-WEB-012"
  ],
  "export_id": "SIGEXP-SF-057",
  "export_version": 1,
  "external_provider_state": "NOT_RUN",
  "freshness": {
    "observed_at": "2026-08-25T00:00:00+03:00",
    "supersedes_export_id": null,
    "valid_until": null
  },
  "generated_at": "2026-08-25T00:00:00+03:00",
  "pattern": {
    "a_roll_integration": "absent",
    "broll_function": "demonstrate_process",
    "cta_exit": "answer_question",
    "hook_mechanism": "direct_promise",
    "pacing_profile": "slow_observation",
    "proof_form": "worked_example",
    "risk_class": "low",
    "sound_role": "music_pulse",
    "text_role": "step_counter",
    "transition_family": "wipe",
    "viewer_job": "imagine_outcome",
    "visual_grammar": "object_macro"
  },
  "provenance": {
    "raw_object_state": "NOT_AVAILABLE",
    "record_hash": "sha256:4e177320bfc81f430ec8d10e62dc1398c0afcecc19b171bde82f89bcb620fe14",
    "source_raw_hashes": []
  },
  "rights_decision_ids": [
    "RIGHTS-PUBLIC-COMMENTARY-001"
  ],
  "rights_state": "metadata_commentary_only",
  "schema": "signal-to-studio.v1",
  "signal_record_id": "SIG-SF-057",
  "source_ids": [
    "SRC-WEB-008"
  ],
  "studio_constraints": {
    "acceptance_checks": [
      "Opening hook signal occurs in the first 1000 ms.",
      "Every visual change has a story function and explicit A-roll state.",
      "No source expression, brand UI, identity, or restricted media is reused."
    ],
    "aspect_ratio": "9:16",
    "duration_ms": 6000,
    "editable_text": true,
    "safe_zone": "platform-ui-aware; 8% horizontal and 10% vertical local planning inset; verify per platform at production"
  },
  "taxonomy_version": "studio-shortform@1.0.0"
}
